{
  "$schema": "http://json-schema.org/draft-07/schema#",
  "$id": "https://duong-ve-sai-gon.local/schemas/mission.schema.json",
  "title": "MissionDefinition",
  "description": "PRD §8 — MissionDefinition + MissionNode. Runtime chỉ thực thi action/condition trong allow-list.",
  "type": "object",
  "required": [
    "id",
    "version",
    "seedPolicy",
    "startNode",
    "checkpoints",
    "localization",
    "nodes"
  ],
  "additionalProperties": false,
  "properties": {
    "id": {
      "type": "string",
      "pattern": "^[a-z0-9_-]+$"
    },
    "version": {
      "type": "string",
      "pattern": "^\\d+\\.\\d+\\.\\d+$"
    },
    "seedPolicy": {
      "enum": [
        "fixed",
        "random"
      ]
    },
    "seed": {
      "type": "integer",
      "minimum": 0
    },
    "startNode": {
      "type": "string"
    },
    "checkpoints": {
      "type": "array",
      "items": {
        "type": "string"
      },
      "uniqueItems": true
    },
    "localization": {
      "type": "string",
      "enum": [
        "vi"
      ]
    },
    "zones": {
      "type": "array",
      "items": {
        "type": "object",
        "required": [
          "id",
          "center",
          "radius"
        ],
        "additionalProperties": false,
        "properties": {
          "id": {
            "type": "string"
          },
          "center": {
            "type": "array",
            "items": {
              "type": "number"
            },
            "minItems": 3,
            "maxItems": 3
          },
          "radius": {
            "type": "number",
            "exclusiveMinimum": 0
          }
        }
      }
    },
    "spawnGroups": {
      "type": "array",
      "items": {
        "type": "object",
        "required": [
          "id",
          "archetype",
          "count",
          "spawn"
        ],
        "additionalProperties": false,
        "properties": {
          "id": {
            "type": "string"
          },
          "archetype": {
            "enum": [
              "grunt",
              "recon",
              "squad"
            ]
          },
          "count": {
            "type": "integer",
            "minimum": 1,
            "maximum": 16
          },
          "spawn": {
            "type": "string",
            "description": "tên spawn point trong ArenaData"
          },
          "budget": {
            "type": "integer",
            "minimum": 1,
            "maximum": 16
          },
          "spawns": {
            "type": "array",
            "items": {
              "type": "string"
            }
          },
          "faction": {
            "enum": [
              "enemy",
              "friend"
            ]
          },
          "names": {
            "type": "array",
            "items": {
              "type": "string"
            }
          },
          "behavior": {
            "enum": [
              "patrol",
              "hold",
              "ambush",
              "hunt"
            ]
          },
          "patrol": {
            "type": "array",
            "items": {
              "type": "string"
            }
          }
        }
      }
    },
    "nodes": {
      "type": "array",
      "minItems": 1,
      "items": {
        "$ref": "#/definitions/node"
      }
    },
    "$schema": {
      "type": "string"
    }
  },
  "definitions": {
    "node": {
      "type": "object",
      "required": [
        "id",
        "type",
        "enterConditions",
        "actions",
        "exitConditions",
        "next"
      ],
      "additionalProperties": false,
      "properties": {
        "id": {
          "type": "string"
        },
        "type": {
          "enum": [
            "script",
            "objective",
            "encounter",
            "terminal"
          ]
        },
        "enterConditions": {
          "type": "array",
          "items": {
            "$ref": "#/definitions/condition"
          }
        },
        "actions": {
          "type": "array",
          "items": {
            "$ref": "#/definitions/action"
          }
        },
        "exitConditions": {
          "type": "array",
          "items": {
            "$ref": "#/definitions/condition"
          }
        },
        "next": {
          "type": [
            "string",
            "null"
          ]
        },
        "timeoutMs": {
          "type": "integer",
          "minimum": 0
        },
        "fallbackNext": {
          "type": [
            "string",
            "null"
          ]
        }
      }
    },
    "condition": {
      "type": "object",
      "required": [
        "type"
      ],
      "additionalProperties": false,
      "properties": {
        "type": {
          "enum": [
            "zone_enter",
            "group_dead",
            "flag",
            "timeout",
            "active_ms",
            "always",
            "squad_at",
            "group_alive_max"
          ]
        },
        "zone": {
          "type": "string"
        },
        "group": {
          "type": "string"
        },
        "flag": {
          "type": "string"
        },
        "value": {
          "type": "boolean"
        },
        "ms": {
          "type": "integer",
          "minimum": 0
        },
        "count": {
          "type": "integer",
          "minimum": 0
        }
      }
    },
    "action": {
      "type": "object",
      "required": [
        "type"
      ],
      "additionalProperties": false,
      "properties": {
        "type": {
          "enum": [
            "radio",
            "objective",
            "objective_complete",
            "spawn",
            "checkpoint",
            "mission_complete",
            "set_flag",
            "sky_trigger",
            "squad_order",
            "interactable",
            "bombing",
            "reinforce",
            "fx",
            "strike",
            "napalm",
            "mortar",
            "squad_kill",
            "safe_zone",
            "group_hunt"
          ]
        },
        "cue": {
          "type": "string"
        },
        "objectiveKey": {
          "type": "string"
        },
        "group": {
          "type": "string"
        },
        "checkpoint": {
          "type": "string"
        },
        "flag": {
          "type": "string"
        },
        "value": {
          "type": "boolean"
        },
        "marker": {
          "type": "string",
          "description": "objective: zone id làm marker HUD"
        },
        "flight": {
          "type": "string"
        },
        "order": {
          "enum": [
            "follow",
            "hold"
          ]
        },
        "interactId": {
          "type": "string",
          "description": "interactable: id (cờ mission cùng tên = true khi xong; có fuseMs → cờ <id>_blown khi nổ)"
        },
        "zone": {
          "type": "string",
          "description": "interactable: zone đặt điểm tương tác (tâm) + bán kính nhắc"
        },
        "holdMs": {
          "type": "integer",
          "minimum": 0,
          "description": "interactable: giữ phím (ms); 0 = nhấn"
        },
        "promptKey": {
          "type": "string",
          "description": "interactable: khoá hud.prompt.<key>"
        },
        "fuseMs": {
          "type": "integer",
          "minimum": 0,
          "description": "interactable: ngòi nổ sau khi xong (bộc phá)"
        },
        "prop": {
          "type": "string",
          "description": "interactable: prop terrain gỡ khi nổ (rào)"
        },
        "blastRadius": {
          "type": "number",
          "minimum": 0
        },
        "blastDamage": {
          "type": "number",
          "minimum": 0
        },
        "pace": {
          "enum": [
            "march",
            "normal",
            "assault"
          ]
        },
        "from": {
          "type": "array",
          "items": {
            "type": "number"
          },
          "minItems": 2,
          "maxItems": 2
        },
        "to": {
          "type": "array",
          "items": {
            "type": "number"
          },
          "minItems": 2,
          "maxItems": 2
        },
        "count": {
          "type": "integer",
          "minimum": 0
        },
        "durationMs": {
          "type": "integer",
          "minimum": 0
        },
        "delayMs": {
          "type": "integer",
          "minimum": 0
        },
        "radius": {
          "type": "number",
          "exclusiveMinimum": 0
        },
        "damage": {
          "type": "number",
          "minimum": 0
        },
        "kind": {
          "type": "string",
          "description": "DV-084 fx: fire|smoke|black; mortar: mortar|artillery; squad_kill: napalm|fire|blast|shot"
        },
        "at": {
          "type": "array",
          "items": {
            "type": "number"
          },
          "minItems": 2,
          "maxItems": 2,
          "description": "DV-084 fx/strike: điểm (x, z)"
        },
        "scale": {
          "type": "number",
          "exclusiveMinimum": 0
        },
        "height": {
          "type": "number",
          "minimum": 0,
          "description": "DV-084 napalm: độ cao bay (m trên địa hình)"
        },
        "waves": {
          "type": "integer",
          "minimum": 1,
          "description": "DV-084 reinforce: số đợt"
        },
        "intervalMs": {
          "type": "integer",
          "minimum": 0
        },
        "maxAlive": {
          "type": "integer",
          "minimum": 1,
          "description": "DV-084 reinforce: trần địch sống toàn màn"
        },
        "name": {
          "type": "string",
          "description": "DV-084 squad_kill: khoá tên đồng đội (name.khang)"
        },
        "timerMs": {
          "type": "integer",
          "minimum": 0,
          "description": "DV-084 objective: đếm ngược trên HUD"
        },
        "rate": {
          "type": "number",
          "exclusiveMinimum": 0,
          "description": "DV-084 mortar: quả/phút"
        },
        "spare": {
          "type": "number",
          "minimum": 0,
          "description": "DV-084 mortar: không rơi trong bán kính này quanh người chơi"
        }
      }
    }
  }
}
